{
  "schema_version": "1.0",
  "dataset_id": "tokito-example-corpus",
  "dataset_revision": "example-r1",
  "created_at": "2026-08-29T00:00:00Z",
  "items": [
    {
      "item_id": "board-a-session-1-frame-1",
      "board_id": "physical-board-a",
      "board_revision": "rev-a",
      "session_id": "session-1",
      "leakage_group_id": "board-family-a",
      "source_id": "example-source",
      "media": {
        "uri": "fixtures/board-a/frame-1.png",
        "sha256": "sha256:1111111111111111111111111111111111111111111111111111111111111111",
        "size_bytes": 1234,
        "mime_type": "image/png"
      },
      "origin_class": "synthetic",
      "capture": {
        "device_id": "synthetic-renderer-v1", "lens": "virtual", "width": 640, "height": 480,
        "lighting": "uniform", "distance": "not-applicable", "angle": "fronto-parallel",
        "occlusion": "none", "motion": "static"
      },
      "fingerprints": [{ "algorithm": "phash64", "value": "0123456789abcdef" }],
      "lineage": { "parent_item_ids": [], "transform": "source" },
      "status": "active"
    },
    {
      "item_id": "board-b-session-1-frame-1",
      "board_id": "physical-board-b",
      "board_revision": "rev-a",
      "session_id": "session-1",
      "leakage_group_id": "board-family-b",
      "source_id": "example-source",
      "media": { "uri": "fixtures/board-b/frame-1.png", "sha256": "sha256:2222222222222222222222222222222222222222222222222222222222222222", "size_bytes": 1234, "mime_type": "image/png" },
      "origin_class": "synthetic",
      "fingerprints": [{ "algorithm": "phash64", "value": "fedcba9876543210" }],
      "lineage": { "parent_item_ids": [], "transform": "source" },
      "status": "active"
    },
    {
      "item_id": "board-c-session-1-frame-1",
      "board_id": "physical-board-c",
      "board_revision": "rev-a",
      "session_id": "session-1",
      "leakage_group_id": "board-family-c",
      "source_id": "example-source",
      "media": { "uri": "fixtures/board-c/frame-1.png", "sha256": "sha256:3333333333333333333333333333333333333333333333333333333333333333", "size_bytes": 1234, "mime_type": "image/png" },
      "origin_class": "synthetic",
      "fingerprints": [{ "algorithm": "phash64", "value": "0f0f0f0f0f0f0f0f" }],
      "lineage": { "parent_item_ids": [], "transform": "source" },
      "status": "active"
    },
    {
      "item_id": "board-d-session-1-frame-1",
      "board_id": "physical-board-d",
      "board_revision": "rev-a",
      "session_id": "session-1",
      "leakage_group_id": "board-family-d",
      "source_id": "example-source",
      "media": { "uri": "fixtures/board-d/frame-1.png", "sha256": "sha256:4444444444444444444444444444444444444444444444444444444444444444", "size_bytes": 1234, "mime_type": "image/png" },
      "origin_class": "synthetic",
      "fingerprints": [{ "algorithm": "phash64", "value": "f0f0f0f0f0f0f0f0" }],
      "lineage": { "parent_item_ids": [], "transform": "source" },
      "status": "active"
    }
  ],
  "integrity": { "manifest_digest": "sha256:0000000000000000000000000000000000000000000000000000000000000000" }
}
